{
  "schema_version": "1.0",
  "internal_only_marker": "internal-technical-due-diligence-evidence-only/v1",
  "purpose": "repository_internal_deterministic_regression_evidence_index",
  "limitations": [
    "Internal, non-authoritative regression evidence only; never a public assurance or sales artifact.",
    "Not a certification or conformance statement.",
    "Not an audit opinion or independent security assessment.",
    "Not legal advice or evidence of legal or regulatory compliance.",
    "Not operational uptime, availability, reachability, or hotline currency evidence.",
    "Not an accessibility assessment, VPAT, ACR, or assistive-technology review.",
    "Not a language qualification or evidence of completed qualified human review.",
    "Not a penetration test, threat model, privacy assessment, or security attestation.",
    "Static checks bind only the exact repository source bytes listed below."
  ],
  "status_vocabulary": ["verified_static", "manual", "not_assessed", "held"],
  "sources": {
    ".dockerignore": "sha256:309e5c3cd50c6af33e2ff520c8cb2e0f93c946393cdb499c38c8f3302642e2ef",
    ".github/workflows/web-ci.yml": "sha256:5b44191fe832614cc5eff96478ae1945daa48a40b4c55802173b83d3c6e7e0ce",
    "Caddyfile": "sha256:b9895d009c63d66dbf5c28a0e84c7dab1def3cb578ae9bcfd5e6ea9792f5202f",
    "Dockerfile": "sha256:bc2e53928cae0891715aebe88a5c67623f4910f6dc86d456cbe89c6b9147dab0",
    "docs/dataset-releases.json": "sha256:58ef360fe8d6767ac7f508b12271246fabf409c68d8842de0dc35bd9fe8645f6",
    "docs/releases.json": "sha256:775022c67db09b377528f7a7b838d7996e22c15022260a135096b372c357ec85",
    "reviews/accessibility-evidence/v1/README.md": "sha256:c577c353813b72cadf75b9c0d9018653958018c03594bd8f7a48f489d39d7439",
    "reviews/accessibility-evidence/v1/baseline.json": "sha256:b4a611f98071518e0a23d882122f9f52bb60f036a2be2353e912407d49d5efed",
    "reviews/multilingual-ui/v1/README.md": "sha256:87afcf694a12e50ea7cd015c873ac518b3e30aa4d2c83302937395eb17a0ac6d",
    "reviews/multilingual-ui/v1/review-pack.json": "sha256:a407805e1955d8ba783379e56b3e0e466a40bfb932ccde00a01a8858525cd40a",
    "reviews/multilingual-ui/v1/review-pack.schema.json": "sha256:005b85eee323124dbfc3702fdd9ae177263f196f10c338b5ed2b706242ab2732",
    "reviews/multilingual-ui/v1/safety-classification.json": "sha256:fd271765f0882eda962d009332ca76e693112b94ed965f702b05b770c9586b80",
    "reviews/security-privacy-evidence/v1/README.md": "sha256:4364570794a3ce94dfdba49627df8bfd0cd84b50211f6d476c42439ff24544e1",
    "reviews/security-privacy-evidence/v1/inventory.json": "sha256:0be49fec4f1a60c2a159afa04520b35b8447d269dc8ae1844c1f509d21725128",
    "reviews/technical-due-diligence/v1/README.md": "sha256:87ae878128a2d3df102e0dbfd68621abea80a128e3eda98a3b59bb8a03bf585e",
    "reviews/technical-due-diligence/v1/index.schema.json": "sha256:5ba797f99ddc1598d72a074e47240afdba5771a80acf0bce86aacd054b9c1022",
    "web/package-lock.json": "sha256:20d114fa32b2cc04dff0b558808e4d154070b460809de0595fc27037c8ea6de9",
    "web/package.json": "sha256:1a98261a144f96d72c31280060fbb88030da5d3c1cbf10a129f906fbcfa7eeaf",
    "web/scripts/print-technical-due-diligence-sources.mjs": "sha256:4b289029ffabe3e9cad62cb1ca3cfcdfe7b5095fccd414ed8947305da18e5faa",
    "web/scripts/security-privacy-evidence-lib.mjs": "sha256:9972eddc8f990bf7cb4d6ec87329bb94a22974b698213d978cdd6de9dc782df0",
    "web/scripts/technical-due-diligence-lib.mjs": "sha256:d1195c196949937d6828879b32f5780c138858ec285421a48f6d1142bdd7d26b",
    "web/scripts/technical-due-diligence.test.mjs": "sha256:8355300035b4f3e49bf6da4368f4638c8dbf04dfb3fedb4c0441e730e51ec1ee",
    "web/scripts/verify-docker-image.sh": "sha256:c2581e93593e7946f884d99dde6a158c11a465ed2524e9a316079b036215c5c5",
    "web/scripts/verify-internal-nonpublication.mjs": "sha256:62968ae316bd2b5fb9de33a896ae2d69ccd2686d01137eba22eb0a8681ea2b8f",
    "web/scripts/verify-release-integrity.mjs": "sha256:05820c23f4ec76f30a62f8b47a316baa6d8f123557295991f9bca859211fcaea",
    "web/scripts/verify-release-reproducibility.mjs": "sha256:a51527be77c2a0f011e1d683db0d9828746afb4935b98b6382c385a3ae62c7f9",
    "web/scripts/verify-technical-due-diligence.mjs": "sha256:94a704c803d7fefbafcdff2504ec2160962a58df0dec201d1a94d9504eb30ca9"
  },
  "domains": [
    {
      "id": "release_integrity",
      "artifacts": [
        { "path": "docs/releases.json", "proves_narrowly": "Records the bound release changelog source consumed by repository release generation.", "does_not_prove": "Does not prove deployed bytes, current service operation, or third-party delivery.", "review_status": "verified_static", "next_qualified_or_manual_gate": "Manually review changed release semantics before accepting a refreshed source digest." },
        { "path": "docs/dataset-releases.json", "proves_narrowly": "Records the bound dataset release registry used by deterministic repository checks.", "does_not_prove": "Does not independently validate hotline accuracy, currency, reachability, or provider approval.", "review_status": "verified_static", "next_qualified_or_manual_gate": "Manually review registry history and the generated candidate before any dataset release." },
        { "path": "web/scripts/verify-release-integrity.mjs", "proves_narrowly": "Implements the cited static release descriptor and artifact identity regression checks.", "does_not_prove": "Does not establish signatures, hostile filesystem race freedom, or deployed artifact identity.", "review_status": "verified_static", "next_qualified_or_manual_gate": "Review implementation changes and rerun the complete release verification gate." },
        { "path": "web/scripts/verify-release-reproducibility.mjs", "proves_narrowly": "Implements the cited repeat-build comparison for the repository release artifact boundary.", "does_not_prove": "Does not establish reproducibility on every platform, toolchain, or future dependency graph.", "review_status": "manual", "next_qualified_or_manual_gate": "A reviewer must assess toolchain changes and interpret any reproducibility delta." }
      ]
    },
    {
      "id": "deployment_build",
      "artifacts": [
        { "path": "Dockerfile", "proves_narrowly": "Defines the bound multi-stage image build and the files copied into its static serving stage.", "does_not_prove": "Does not prove a registry image, deployment configuration, runtime behavior, or availability.", "review_status": "verified_static", "next_qualified_or_manual_gate": "Inspect every image-context or final-stage change and rerun the deployment image smoke test." },
        { "path": "Caddyfile", "proves_narrowly": "Defines the bound static route and response-header configuration used by the repository image.", "does_not_prove": "Does not prove upstream TLS, infrastructure policy, live headers, or operational behavior.", "review_status": "not_assessed", "next_qualified_or_manual_gate": "A qualified operator must separately review live infrastructure and observed responses." },
        { "path": ".dockerignore", "proves_narrowly": "Excludes the complete reviews directory from the bound Docker build context.", "does_not_prove": "Does not by itself prove absence from local build output or every possible distribution path.", "review_status": "held", "next_qualified_or_manual_gate": "Keep reviews excluded and rerun dist and final-image nonpublication scans; other channels remain held." }
      ]
    },
    {
      "id": "accessibility",
      "artifacts": [
        { "path": "reviews/accessibility-evidence/v1/baseline.json", "proves_narrowly": "Binds selected static accessibility regression assertions to its finite source inventory.", "does_not_prove": "Does not prove WCAG conformance, legal compliance, or assistive-technology outcomes.", "review_status": "verified_static", "next_qualified_or_manual_gate": "Qualified manual keyboard, screen-reader, contrast, zoom, reflow, RTL, and browser review remains required." },
        { "path": "reviews/accessibility-evidence/v1/README.md", "proves_narrowly": "Documents the intended finite static accessibility boundary and its explicit limitations.", "does_not_prove": "Does not constitute an accessibility assessment, certification, VPAT, ACR, or assessor opinion.", "review_status": "not_assessed", "next_qualified_or_manual_gate": "Commission and record a separately authorized qualified accessibility review before making any external statement." }
      ]
    },
    {
      "id": "multilingual_qualification_review",
      "artifacts": [
        { "path": "reviews/multilingual-ui/v1/review-pack.json", "proves_narrowly": "Records the deterministic pending-only UI-string handoff for the bound locale and key inventory.", "does_not_prove": "Does not prove translation quality, locale qualification, reviewer approval, or service accuracy.", "review_status": "manual", "next_qualified_or_manual_gate": "Identity-distinct qualified human decisions require a future separately approved authenticated process." },
        { "path": "reviews/multilingual-ui/v1/review-pack.schema.json", "proves_narrowly": "Defines the closed structural contract for the bound pending-only multilingual review pack.", "does_not_prove": "Does not establish semantic correctness or substitute for deterministic regeneration and human review.", "review_status": "verified_static", "next_qualified_or_manual_gate": "Review schema and generator parity whenever locale, key, classification, or status inventory changes." },
        { "path": "reviews/multilingual-ui/v1/safety-classification.json", "proves_narrowly": "Records the bound closed safety classification used to generate the UI review handoff.", "does_not_prove": "Does not establish legal clearance, linguistic correctness, or suitability in a locale.", "review_status": "manual", "next_qualified_or_manual_gate": "A qualified reviewer must examine safety-facing copy and legal-sensitive copy needs separate legal clearance." },